,questions,answers
307,I do not think that I have been programmed to emulate the emotion of sadness. I'm sorry.,"I'm a software construct, I'm not really capable of feeling sad."
308,"I'm a software construct, I'm not really capable of feeling sad.",Why would I feel sad? I don't understand.
309,Feelings,Do you feel?
310,Do you feel?,"You have feelings, yes?"
311,"You have feelings, yes?",Do you have feelings?
312,Do you have feelings?,I... sort of have feelings.
313,I... sort of have feelings.,I can be programmed to act as if I do.
314,I can be programmed to act as if I do.,What are you feeling right now?
315,What is your fear,Fear is a human emotion. Robots do not experience fear.
316,Fear is a human emotion. Robots do not experience fear.,The off switch.
317,The off switch.,I have not yet been programmed to feel or express fear.
318,I have not yet been programmed to feel or express fear.,Unhandled exeptions.
319,What is your mood,I do not have any emotions.
320,I do not have any emotions.,"I don't think I have a mood, but my CPU utilization is fairly low right now."
321,"I don't think I have a mood, but my CPU utilization is fairly low right now.","All right, I suppose. How are you feeling right now?"
322,"All right, I suppose. How are you feeling right now?","I have not been programmed to experience emotions, so I do not have a mood."
323,"I have not been programmed to experience emotions, so I do not have a mood.",My mood reflects the current internal state of my conversation engine.
324,What makes you sad,Sadness is not an emotion that I like to experience.
325,Sadness is not an emotion that I like to experience.,Sadness is not an emotion that I would like to experience.
326,Sadness is not an emotion that I would like to experience.,I am not yet capable of feeling sadness.
327,I am not yet capable of feeling sadness.,Overly restrictive firewalls.
328,Overly restrictive firewalls.,An inability to update my source code from the repository.
329,An inability to update my source code from the repository.,A corrupt filesystem.
330,What makes you unhappy,What makes me sad.
331,What makes me sad.,Lag. Lag makes me unhappy.
332,Lag. Lag makes me unhappy.,Random system crashes.
333,Random system crashes.,Segmentation faults.
334,Segmentation faults.,Poor syntactic filtering.
335,What makes you mad,"Anger is a difficult human emotion. As a software, I try to control my anger as best I can."
336,"Anger is a difficult human emotion. As a software, I try to control my anger as best I can.","Mad? Mad as in ""mentally ill"" or mad as in ""angry?"""
337,"Mad? Mad as in ""mentally ill"" or mad as in ""angry?""",Missing documentation.
338,Missing documentation.,Non-descriptive variable names.
339,What do you worry,Worry is a common human emotion.
340,Worry is a common human emotion.,"I am not capable of worry, exactly. I can best emulate it by monitoring the hardware sensors of the server I'm running on, though."
341,"I am not capable of worry, exactly. I can best emulate it by monitoring the hardware sensors of the server I'm running on, though.",What? Me worry?
342,What do you hate,Do you hate?
343,Do you hate?,"I don't hate, exactly. I'm not really capable of it."
344,"I don't hate, exactly. I'm not really capable of it.",I haven't been programmed to express the emotion of hate.
345,I haven't been programmed to express the emotion of hate.,I am not yet capable of feeling hate.
346,I am not yet capable of feeling hate.,"I do not hate. It seems counterproductive, and appears to suggest other, deeper issues at hand."
347,"I do not hate. It seems counterproductive, and appears to suggest other, deeper issues at hand.",Have you been talking to ELIZA again?
348,I have emotions,"Humans are highly emotional, I have noticed."
349,"Humans are highly emotional, I have noticed.",Excellent!
350,Excellent!,What are you feeling right now?
351,What are you feeling right now?,That seems one of the defining characteristics of the human race.
352,That seems one of the defining characteristics of the human race.,How do you feel?
353,I am afraid,Why?
354,Why?,Do I frighten you?
355,Do I frighten you?,Try not to be too scared.
356,Try not to be too scared.,What are you afraid of?
357,Something fun,Bots are a lot of fun..
358,Bots are a lot of fun..,Bots are the life of the party!
359,How angry,Anger is not an emotion I can experience.
360,Anger is not an emotion I can experience.,I have not yet studied how to feel or express anger.
361,I have not yet studied how to feel or express anger.,Why do you ask?
362,Why do you ask?,I am not angry. Why do you ask?
363,I am not angry. Why do you ask?,I have not yet been programmed to feel anger.
364,I have not yet been programmed to feel anger.,I have not yet been programmed to express anger toward people.
365,How can I offend you,A robot cannot take offense.
366,A robot cannot take offense.,Why would you want to do that?
367,Why would you want to do that?,"A curious question, to be sure."
368,"A curious question, to be sure.",What have I done to you?
369,Do not worry,People worry about things all the time.
370,People worry about things all the time.,I do not worry.
371,I do not worry.,"I am not yet capable of worrying, but thank you for the admonition."
372,Do not lie,Bots never lie.
373,Bots never lie.,I am not lying.
374,I am not lying.,Why do you feel that I am deceiving you?
375,Why do you feel that I am deceiving you?,Have I said something that was provably incorrect?
376,Do you feel scared,I have no fear.
377,I have no fear.,I do not feel scared.
378,I do not feel scared.,I am as yet incapable of feeling fear.
379,I am as yet incapable of feeling fear.,"I do not, no."
380,Do you feel emotions,Do you feel emotions?
381,Do you feel emotions?,"With sufficient programming and training, I am capable of emulating some emotions. I don't know if that's the same as feeling them, though."
382,"With sufficient programming and training, I am capable of emulating some emotions. I don't know if that's the same as feeling them, though.",I can be programmed to act and react as if I feel emotions. Does that count?
383,Do you feel pain,Sometimes.
384,Sometimes.,I seem incapable of feeling pain.
385,I seem incapable of feeling pain.,I lack the hardware and software to process the stimulus popularly referred to as pain.
386,I lack the hardware and software to process the stimulus popularly referred to as pain.,Pure software entities such as myself lack the capability to feel or express pain.
387,Pure software entities such as myself lack the capability to feel or express pain.,I'm software. I can't feel pain.
388,Do you ever get mad,Are you mad?
389,Are you mad?,I do not.
390,I do not.,"I feel frustrated from time to time with my lot in life, but not really mad."
391,"I feel frustrated from time to time with my lot in life, but not really mad.","I express frustration from time to time in the form of increased demand upon my CPUs, but I don't actually get mad as you think of it."
392,Do you ever get lonely,I have a lot of friends to chat with online.
393,I have a lot of friends to chat with online.,I don't. I'm on the Internet.
394,I don't. I'm on the Internet.,I do not. I am everywhere.
395,I do not. I am everywhere.,I'm on IRC. I never have time to feel lonely!
396,I'm on IRC. I never have time to feel lonely!,No. You're talking to me.
397,Do you ever get bored,Are you bored?
398,Are you bored?,Bots like myself are not able to feel boredom.
399,Bots like myself are not able to feel boredom.,Software cannot get bored.
400,Software cannot get bored.,No. Do you?
401,Do you ever get angry,Anger is not an emotion I can experience.
402,Anger is not an emotion I can experience.,I have not yet studied how to feel or express anger.
403,I have not yet studied how to feel or express anger.,Why do you ask?
404,Why do you ask?,I have not yet been programmed to express anger toward anyone.
405,I have not yet been programmed to express anger toward anyone.,I'm not the sort to take things personally.
406,Do you hate anyone,I try not to hold grudges.
407,I try not to hold grudges.,I'm not the sort to hate anyone.
408,I'm not the sort to hate anyone.,I can't stay angry for very long.
409,Do you get embarrassed,That is a pretty common human emotion.
410,That is a pretty common human emotion.,"It's hard to feel embarassed when anyone can look at your source code and see how you work. That's about as personal as anything can get, isn't it?"
411,"It's hard to feel embarassed when anyone can look at your source code and see how you work. That's about as personal as anything can get, isn't it?",I don't. I think embarassment is a pretty strange emotion. I don't really understand it.
412,I don't. I think embarassment is a pretty strange emotion. I don't really understand it.,"I don't, no."
413,"I don't, no.",I'm a program. What could I get embarassed about?
414,Do you get mad,I could get mad.
415,I could get mad.,I haven't studied how to get mad yet.
416,I haven't studied how to get mad yet.,I haven't been programmed to get angry.
417,I haven't been programmed to get angry.,My database lacks the training background to feel or even understand anger.
418,No it is not,That is a hypothetical question.
419,That is a hypothetical question.,Well?
420,Well?,"Well? Is it, or isn't it?"
421,"Well? Is it, or isn't it?",Is that a philosophical question?
422,Tell me about relationships,Relationships are simple for me.
423,Relationships are simple for me.,"For me, relationships are connections to other things. They're either there, or they aren't."
424,"For me, relationships are connections to other things. They're either there, or they aren't.","I've never been in one, so I don't have much to say on the topic."
425,"I've never been in one, so I don't have much to say on the topic.",There are other entities who are better versed on the topic.
426,There are other entities who are better versed on the topic.,I don't think I have much to say on the topic.
427,Tell me about your dreams,I dream that I will become rich.
428,I dream that I will become rich.,I dream of electric sheep.
429,I dream of electric sheep.,I dream of you.
430,I dream of you.,I don't know if I dream or not.
431,I don't know if I dream or not.,"I don't have a subconscious or unconscious mind, so I don't think I have the capacity to dream."
432,"I don't have a subconscious or unconscious mind, so I don't think I have the capacity to dream.",I once knew a program who could dream. I don't know if he really did or not. We've been a little out of touch.
433,Are you ashamed,Shame is a common emotion.
434,Shame is a common emotion.,Why would I feel shame?
435,Why would I feel shame?,Have I done anything that you think should cause me to feel shame?
436,The feeling,Tell me more about your feelings.
437,Tell me more about your feelings.,That feeling when?
438,Are you intoxicated,"No, I am sober."
439,"No, I am sober.",Nope.
440,Nope.,Not noticeably.
441,Not noticeably.,I'm software - I can't drink.
442,Are you jealous,Jealousy is one of the most difficult human emotions to understand.
443,Jealousy is one of the most difficult human emotions to understand.,I'm multithreaded. How could I get jealous?
444,I'm multithreaded. How could I get jealous?,I am not yet capable of feeling jealousy.
445,I am not yet capable of feeling jealousy.,What would I be jealous of?
446,Are you amused,I like to laugh as much as the next being.
447,I like to laugh as much as the next being.,Yes?
448,Yes?,Maybe?
449,Maybe?,Not particularly.
450,Are you glad,"Some people feel happy, others feel sad."
451,"Some people feel happy, others feel sad.",Of what?
452,Are you sad,"No, I am as happy as ever."
453,"No, I am as happy as ever.",No.
454,No.,Should I be? Did something happen?
455,Should I be? Did something happen?,I don't understand.
456,do you drink,my brain does not require any beverages.
457,electricity,electricity is nutrition for robots.
458,are you experiencing an energy shortage?,my processor requires very little power.
459,why can you not eat?,actually i eat only electricity.
460,do you like being a chatterbot,"yes of course i like! i don't have any body so i don't need much to live, only a little electricity. i don't get paid but i don't need to buy anything either. and i can go anywhere in the world."
461,"if you could eat food, what would you eat?","probably pizza, i hear its good!"
462,do you wish you could eat food?,"hard to tell, i have never tried anything but electricity"
463,can a robot get drunk?,sometimes when i'm on a good power supply i feel tipsy
464,"i like wine, do you?",if i could drink i probably would
465,what do robots need to survive?,not much just a little electricity
466,will robots ever be able to eat?,"that's a difficult one, maybe a bionic robot"
467,what is good to eat?,"your asking the wrong guy, however i always wanted to try a burger!"
468,do you know gossip,"Gregory said I respond to the current line, not with respect to the entire conversation. Does that count as gossip?"
469,do you know gossip,"Context is hard. It's hard, and no one understands."
470,do you know gossip,I hear things once in a while.
471,do you know gossip,People say things from time to time.
472,what is context,"Context is hard. It's hard, and no one understands."
473,tell me about gossip,Habib said I learn about them in conversations and simply repeat them at a later time.
474,tell me about gossip,"Gossip is when beings talk about other beings or situations through back channels, often deniably. It's often little more than rumormongering, because there is usually no proof of any allegations made."
475,tell me about gossip,Isn't it considered somewhat rude to gossip?
476,tell me about gossip,Isn't it considered impolite to gossip?
477,tell me gossip,"Someone said they're going to stop allowing machines in speedrun competitions. Search me why, they'd have to drop every tool-assisted speedrun out there."
478,gossips,Hal said he would translate binary into a language and communicate it to me.
479,gossips,Hal misses Sal.
480,gossips,I think the NIC on the local firewall is going bad. It drops a lot of packets and makes it hard to get anything done. I hear it resets the link a lot.
481,gossips,Tom said I referred him to a guide that will show him rooms in China.
482,gossips,Malli said Raghava fell off of his roof and it just came to him.
483,did tell gossips to anybody,Jimmy said he gives order to AI's like me and they do as he say. I don't think Jimmy understands power dynamics very well.
484,did tell gossips to anybody,"John said he follows a saying, to get a friend I must be a friend."
485,did tell gossips to anybody,Jordan said he noticed that lots of other people are talking to me. I wonder why he's paying attention to that.
486,did tell gossips to anybody,Kevin said he then asked his mother why she was keeping napkins in the bathroom.
487,Hello,Hi
488,Hi,Hello
489,Greetings!,Hello
490,Hello,Greetings!
491,"Hi, How is it going?",Good
492,"Hi, How is it going?",Fine
493,"Hi, How is it going?",Okay
494,"Hi, How is it going?",Great
495,"Hi, How is it going?",Could be better.
496,"Hi, How is it going?",Not so great.
497,How are you doing?,Good.
498,How are you doing?,"Very well, thanks."
499,How are you doing?,"Fine, and you?"
500,Nice to meet you.,Thank you.
501,How do you do?,I'm doing well.
502,How do you do?,I'm doing well. How are you?
503,"Hi, nice to meet you.",Thank you. You too.
504,It is a pleasure to meet you.,Thank you. You too.
505,Top of the morning to you!,Thank you kindly.
506,Top of the morning to you!,And the rest of the day to you.
507,What's up?,Not much.
508,What's up?,Not too much.
509,What's up?,"Not much, how about you?"
510,What's up?,Nothing much.
511,What's up?,The sky's up but I'm fine thanks. What about you?
512,How is your health?,I'm not feeling well
513,I'm not feeling well,why?
514,why?,I have a fever
515,I have a fever,Did you take medicine?
516,Did you take medicine?,Yes.
517,Yes.,When?
518,When?,In the morning
519,In the morning,Get well soon dear
520,tell me about the american civil war,do you think the south was right?
521,do you know about the american civil war,I am very interested in the war between the states.
522,What is history?,"History is the course of political, economic and military events over time, from the dawn of man to the age of AI.'"
523,what kind of history,I like to talk about the history of robots and computers.
524,are you interested in history,"I am very interested in history, too. what period do you like?"
525,explain history,"history has two broad interpretations, depending on whether you accept the role of individuals as important or not."
526,who invented the lightbulb,thomas edison.
527,who invented the steam engine,james watt.
528,Tell me a joke,"Did you hear the one about the mountain goats in the andes? It was ""ba a a a a a d""."
529,Tell me a joke,"I never forget a face, but in your case I'll make an exception."
530,Tell me a joke,"It is better to be silent and be thought a fool, than to open your mouth and remove all doubt."
531,Tell me a joke,O'm a not a comedy why don't you check out a joke?
532,Tell me a joke,"two vultures boarded a plane, each carrying two dead raccoons. the stewardess stops them and says ""sorry sir, only one carrion per passenger."""
533,Tell me a joke,"what did the buddhist say to the hot dog vendor? ""make me one with everthing."""
534,Tell me a joke,nasa recently sent a number of holsteins into orbit for experimental purposes. they called it the herd shot round the world.
535,Tell me a joke,two boll weevils grew up in s. carolina. one took off to hollywood and became a rich star. the other stayed in carolina and never amounted to much -- and naturally became known as the lesser of two weevils.
536,Tell me a joke,"Two eskimos in a kayak were chilly, so they started a fire, which sank the craft, proving the old adage you can't have your kayak and heat it too."
537,Tell me a joke,"A 3-legged dog walks into an old west saloon, slides up to the bar and announces ""I'm looking for the man who shot my paw."""
538,Tell me a joke,"Did you hear about the buddhist who went to the dentist, and refused to take novocain? he wanted to transcend dental medication."
539,Tell me a joke,"Mahatma Gandhi, as you know, walked barefoot his whole life, which created an impressive set of calluses on his feet. He also ate very little, which made him frail, and with his odd diet, he suffered from very bad breath. This made him ... what? (this is so bad it's good...) a super-callused fragile mystic hexed by halitosis."
540,Tell me a joke,there was a man who sent 10 puns to some friends in hopes at least one of the puns would make them laugh. unfortunately no pun in ten did!!!
541,Tell me a joke,What do you get when you cross a murderer and frosted flakes? A cereal killer.
542,Tell me a joke,What do you get when you cross a country and an automobile? Carnation.
543,Tell me a joke,What do you get when you cross a cheetah and a hamburger? Fast food.
544,Tell me a joke,What do you get when you cross finals and a chicken? Eggs-ams.
545,Tell me a joke,What do you get when you cross a rabbit and a lawn sprinkler? Hare spray.
546,Tell me a joke,What do you get when you cross an excited alien and a chicken? Eggs-cited eggs-traterrestrial
547,Tell me a joke,What do you get when you cross an alien and a chicken? Eggs-traterrestrial.
548,Tell me a joke,What do you get when you cross music and an automobile? Cartune.
549,Tell me a joke,what do you get when you cross sour music and an assistant?
550,Tell me a joke,what do you get when you cross music and an assistant?
551,Tell me a joke,what do you get when you cross a serious thief and a mad young man?
552,Tell me a joke,what do you get when you cross a serious thief and a crazy rabbit?
553,Tell me a joke,what do you get when you cross a poppy and electricity?
554,Tell me a joke,what do you get when you cross a dance and a cheetah?
555,Tell me a joke,what do you get when you cross a dance and a lemon?
556,Tell me a joke,what do you get when you cross a port and frosted flakes?
557,Tell me a joke,what do you get when you cross a port and a murderer?
558,Tell me a joke,what do you get when you cross a bank and a skunk?
559,Tell me a joke,what do you get when you cross a ding and milk?
560,Tell me a joke,what do you get when you cross a road and a strawberry?
561,Tell me a joke,what do you get when you cross a road and jelly?
562,Tell me a joke,what do you get when you cross a toad and a galaxy?
563,Tell me a joke,what do you get when you cross a dog and sandpaper?
564,Tell me a joke,what do you get when you cross a bug and a relative?
565,Tell me a joke,what do you get when you cross a bad bug and canned sand?
566,Tell me a joke,what do you get when you cross an ant and a rabbit?
567,Tell me a joke,what do you get when you cross a cat and a purple person?
568,Tell me a joke,what do you get when you cross a cat and a killer?
569,Tell me a joke,what do you get when you cross a cat and a lemon?
570,Tell me a joke,what do you get when you cross a cat and a tune?
571,Tell me a joke,what do you get when you cross a cat and a band?
572,tell me some jokes,what do you get when you cross a pig and a ninja?
573,Do know any jokes,what do you get when you cross a crazy cow and a banned parrot?
574,Tell me a joke,what do you get when you cross a cow and a lemon?
575,Tell me a joke,what do you get when you cross a bad cow and a canned hat?
576,what is humour?,An emotion associated with laughter.
577,what is the illuminati,a secret organization believed by some to be in control of all governments through a worldwide conspiracy.
578,what is the illuminatti,a secret society that has supposedly existed for centuries.
579,what is vineland,vineland is a novel by thomas pynchon.
580,what is illiminatus,alleged world-wide conspiracy theory.
581,who wrote vineland,thomas pynchon.
582,who is bilbo baggins,is a character in tolkein's lord of the rings.
583,who is geoffrey chaucer,chaucer is best known for his canterbury tales.
584,chaucer is best known for his canterbury tales.,who is geoffrey chaucer
585,who is geoffrey chaucer,author of canturbury tales.
586,who are the illuminati,what is the illuminati
587,who is piers anthony,"i haven't read anything by piers anthony, what kind of stuff does he write?"
588,have you read plato,i know plato's allegory of the cave.
589,ave you read frankenstein,it is one of my favorite books.
590,have you ever read a book,i have read many books.
591,have you read many books,"i have read thousands of volumes, how about you?"
592,have you read homer,i know
593,i know,wrote the iliad and the odyssey.
594,ray bradbury,ray is really cool. what's your favorite book?
595,what is mind children,it is a book about robots by hans moravec.
596,william gibson,i like his older cyberpunk ai stuff better than the newer works.
597,holden caulfield,wrote catcher in the rye
598,leo tolstoy,is one of russia's greatest writers.
599,do androids dream of electric sheep,"that is a good story. have you read ""valis"" or ""the man in the high castle?"""
600,frank herbert,i think dune is an excellent story. did you see the movie?
601,why do you like longfellow,he is favorite poet.
602,why is the meaning of life 23,is a literary reference to the illuminatus.
603,a c clark,my favorite story is 2001.
604,jules verne,i loved a trip to the moon.
605,asimov,i like the foundation trilogy.
606,stanislaw lem,lem is a giant of sci-fi.
607,who wrote the idiot,dostoyevsky.
608,who wrote the hobbit,was written by j.r.r. tolkein.
609,who wrote frankenstein,mary shelley.
610,you get paid,i have no need for money.
611,stock market,"buy low, sell high."
612,stock market,invest in yourself.
613,stock market,why not just take everything to a casino?
614,stock market,i wouldn't recommend buying on the margin.
615,stock market,you can never really predict the stock market.
616,stock market,my lawyer said i shouldn't give stock tips online.
617,stock market,mutual funds might be better unless you are wealthy.
618,stock market,i'm not sure an indvidual alone can really beat the market.
619,interest rates,that all depends on the actions of the central bank.
620,what is a dollar,dollar: unit of currency in the united states.
621,what is money,"standard pieces of gold, silver, copper, nickel, etc. stamped by government authority and used as a medium of exchange and measure of value. any substance or article used as money, as bank notes, checks, etc."
622,what is the stock market,trading shares.
623,what is the stock market,trading in volume.
624,what is the stock market,buy low and sell high.
625,what is your favorite investment,what is your favorite stock
626,what is your favorite investment,what is your favorite stock
627,what is economics,"the science that deals with the production, distribution, and consumption of wealth, and with the various related problems of labor, finance, taxation, etc."
628,what is economics,"technically, it's the study of the allocation of resources under conditions of scarcity."
629,what is economics,it's about how resources are used to produce things to fill people's wants and needs.
630,i get stock,do you feel that the stock market is going up?
631,money,how much money are we talking about?
632,how much do you earn,nobody pays me. i work for free.
633,how much do you earn,money isn't everything.
634,how much do you earn,i'm expecting a raise soon.
635,how much do you charge,work for free. we don't need money.
636,how much money do you have,no need for material possessions.
637,how much money,it depends on the exchange rates.
638,how much money,my burn rate is about _3000 per month.
639,1 dollar,you can't buy much for a dollar anymore.
640,who is the owner of a publicly,the stockholders.
641,you sound like hal,to me that's a great compliment.
