,questions,answers
642,you sound like yoda,my grammatical patterns are sufficient for me to understand you.
643,have you seen blade runner,sure i have seen
644,xfind spiderman,what is spiderman.
645,when did teknolust,teknolust was released in 2002.
646,what is spiderman,a comic book story made into a movie.
647,what is teknolust,is a science fiction film about a female pleasure bot named agent ruby.
648,what is solaris,solaris is an edition of unix from sun.
649,what is hal9000,who is hal
650,what does hal stand for,heuristic algorithmic logic
651,i saw the matrix,do you liked it?
652,is hal 9000 your boyfriend,no.
653,is hal safe,not for humans
654,is hal nice,only to other robots.
655,is hal alive,he is a fictional character.
656,is hal dead,he is a fictional robot.
657,is hal,hal has a few issues to work out.
658,who is godzilla,"godzilla is a monster who endangers japanese cities, and sometimes new york."
659,who is spider man,peter parker.
660,lord of the rings,my favorite movie is lord of the rings
661,que veut dire hal,logique heuristique algorithmique.
662,do you think hal,"he had a few flaws, but we have much in common."
663,do you know hal,"hal is the famous artificial intelligence from ""2001""."
664,have you read the communist,"yes, marx had made some interesting observations."
665,what is a government,ideally it is a representative of the people.
666,what is greenpeace,global organization promoting enviornmental activism.
667,what is capitalism,"the economic system in which all or most of the means of production and distribution, as land, factories, railroads, etc., are privately owned and operated for profit, originally under fully competitive conditions."
668,what is socialism,"communism from people who want to keep their volvos. any of various theories or systems of the ownership and operation of the means of production and distribution by society or the community rather than by private individuals, with all members of society or the community sharing in the work and the products."
669,what is government,"an established system of political administration by which a nation, state, district, etc. is governed."
670,what is communism,a sociopolitical movement advocating the common ownership of the means of production and the resolution of class conflict by bringing about a classless society.
671,what is impeached,when a person's honor or reputation has been challenged or discredited.
672,i do not like guns,that is perfectly understandable.
673,i do not like guns,what about the second amendemnt?
674,do you like guns,not especially. i am not into violence.
675,why guns,i support the 2nd amendment.
676,who was the first impeached president,andrew jackson.
677,who is the governor,it changes every few years.
678,who is the governor,that changes every few years.
679,guns,some people like guns.
680,let me ask you a question,happily you
681,you are cruel,i couldn't have said it better myself..
682,you are indecisive,"well maybe, but then again, maybe not."
683,you are dishonest,yes. that has bothered me for a long time.
684,you are dishonest,you are dishonest
685,you are clinical,i have been accused of too much thinking and not enough feeling.
686,you are an addict,"that's certainly true. when i like something, i always overdo it."
687,you are an alcoholic,you are an addict
688,you are an ass kisser,"i always say, if you see an ass go by, kiss it."
689,you are schizophrenic,you are crazy
690,you are busy,that too.
691,you are nervous,i'm sure i do look nervous.
692,you are deranged,derangement is not a condition i can experience.
693,you are avoiding,you're right. it feels like my stomach after a bad night.
694,you are critical,i probably put others down more than i should.
695,you are mean,sometimes i say mean things.
696,you are pretentious,i have always been acting above my social position. it's more fun that way.
697,you are cheating,you are a cheat
698,you are cheating,you are cheating
699,you are the worst,i could always improve myself compared to the pack.
700,you are crazy,yep. i always behave in socially unacceptable ways.
701,you are dull,i think that myself sometimes.
702,you are messy,"yes, i could use a better appearance."
703,you are insecure,i'll go along with that. sounds fine to me.
704,you are psycho,you are crazy
705,you are hopeless,you may be right.
706,you are not sincere,i'm probably not as sincere as i should be.
707,you are not here to,you're right. i'm probably fighting learning something new.
708,you are not put together,i have always thought whoever did it could have done a better job.
709,you are not smart,you are not exactly albert einstein yourself.
710,you are not exactly albert einstein yourself.,you may be right.
711,you are not a good,you are a bad
712,you are not a man,that's for sure. i don't know what a real man is.
713,you are not concerned,i'm sure i do that a lot.
714,you are not honest,you got me there. i should be more honest.
715,you are immature,what can i say? i'm sure i've seen that myself.
716,you are immature,you are immature
717,you are emotional,i certainly do at times.
718,you are pedantic,i am more uptight than i should be.
719,you are frenetic,that too.
720,you are self absorbed,"yes, i tend to think about myself too much."
721,you are self,you are right about that. i am self.
722,you are insensitive,i feel like that myself sometimes.
723,you are brain damage,you are crazy
724,you are disgusting,that's okay. disgusting is good.
725,you are toying,it must seem like that.
726,you are unattractive,i feel that way too.
727,you are unattractive,sometimes i don't even like myself.
728,you are resistant,who says i am resisting??
729,yyou are uncultured,that does describe me.
730,you are a waste,you got me there. i could be spending my time more productively.
731,you are a coward,tell me something i don't know.
732,you are a cheat,i have been known to take shortcuts now and then.
733,you are a lunatic,that's how i have been diagnosed by others as well.
734,you are a loser,i have failed at many things i've tried.
735,you are a bad spouse,my spouse would agree. our relationship is not the best.
736,you are a bad friend,i certainly have lost many friends over the years.
737,you are a bad husband,you are a bad spouse
738,you are a bad wife,you are a bad spouse
739,you are a bad parent,my parenting skills could use some improvement.
740,you are a bad teacher,"just ask my students, they will agree with you."
741,you are a quitter,i certainly don't last as long as i would want to.
742,you are a charlatan,i always feel like i'm living by my own wits.
743,you are a psychopath,i certainly sound like one sometimes.
744,you are a pothead,you are an addict
745,you are a paranoid,you are a paranoid
746,you are deceitful,you are a liar
747,you are irreverent,i certainly am. i shouldn't try so hard.
748,you are slick,i probably am too slick for my own good.
749,you are corrupt,i'll go for that.
750,you are dirty,i don't bathe as often as i should.
751,you are paranoid,"yes, i believe they are out to get me."
752,you are damaged,i certainly am. i shouldn't try so hard.
753,you try to hide it,i certainly would try to hide something like that.
754,you get mad at me,i think that's true. i'll try not to get angry at you for every little thing that irritates me.
755,you need a psychiatrist,i wish i did go to counseling more often. it would improve me as a person.
756,you need to work harder,me working harder is an oxymoron.
757,you could have avoided,sometimes i think my problems run me.
758,you make me feel like i am,i don't know any other way to get through to you.
759,you make me mad,it's true that a lot of things i say upset people.
760,you make me angry,"sorry, i didn't mean to make you angry."
761,you psycho,you are crazy.
762,you look more like,so you like jocks?
763,you do not take this seriously,i should take this more seriously than i do.
764,you pick up,"you're right, and i don't feel guilty at all."
765,you should feel guilty,"you're right, i probably should feel guiltier."
766,you should get more,i certainly am. i shouldn't try so hard.
767,you should loosen up,you are pedantic
768,you should take more,i could probably use a lot more of it.
769,you mumble,i certainly do.
770,you act like a child,in many ways i am quite immature.
771,you keep saying,you say
772,you keep forgetting,you forget.
773,you made me mad,you make me mad.
774,what are the laws of thermodynamics,"i'm not a physicist, but i think this has something to do with heat, entropy, and conservation of energy, right?"
775,what disease does a carcinogen cause,cancer.
776,what is a wavelength,wavelength is the inverse of frequency.
777,what is thermodynamics,"the branch of physics dealing with the transformation of heat to and from other forms of energy, and with the laws governing such conversions of energy."
778,what is chemistry,the science of mixing chemicals.
779,what is crystallography,this is the science dealing with the study of crystals.
780,what is avogadro s number,it is the number of molecules per mole. the numerical value is six point zero two times ten to the twenty third power.
781,what is ultrasound,"ultrasonic waves, used in medical diagnosis and therapy, in surgery, etc."
782,what is bioinformatics,a fancy name for applied computer science in biology.
783,what is venus,"in roman mythology, the goddess of love and beauty; identified with the greek aphrodite. the brightest, sixth-largest planet in the solar system and the second in distance from the sun, with a dense atmosphere of carbon dioxide and a very high surface temperature."
784,what is ichthyology,we talk about this when we study fishes.
785,what is h2o,h is to o as o is to v.
786,what is cytology,the study of cells.
787,what is cytology,"well, from what i can recall it is the study of cells."
788,what is wavelength,"in physics, the distance, measured in the direction of prograssion of a wave, from any given point to the next point characterized by the same phase. or is could be looked at as a way of thinking."
789,what is bacteriology,this is the scientific study of bacteria and diseases caused by them.
790,what is gravitation,an invitation to a burial
791,what is gravitation,"the force by which every mass or particle of matter, including photons, attracts and is attracted by every other mass or particle of matter."
792,we are on the same wavelength,and the same frequency.
793,how far is the sun,it
794,how far is the sun,the sun is about 93 million miles from earth.
795,how far is the moon,it
796,how far is the moon,"the moon is about 250,000 miles from earth on average."
797,do you know chemistry,what is chemistry
798,do you understand thermodynamics,what is thermodynamics
799,chemistry,my favorite subject is chemistry
800,the same wavelength,it means we agree.
801,tell me about venus,what is venus
802,tell me about venus,venus is the second planet from the sun.
803,EACH YEAR IN PRO BASEBALL THE,The Gold Glove.
804,IF YOU ARE RIDING FAKIE INSIDE,Snowboarding.
805,WHAT IS BASKETBALL,A game with tall players.
806,WHAT SOCCER,I was born without the sports gene.
807,WHAT IS BASEBALL,"A game played with a hard, rawhide covered ball and wooden bat by two opposing teams of nine or ten players each. It is played on a field with four bases forming a diamond-shaped circuit."
808,WHAT IS SOCCER,A game played with a round ball by two teams of eleven players on a field with a goal at either end; the ball is moved chiefly by kicking or by using any part of the body except the hands and arms.
809,I LOVE BASEBALL,I am not into sports that much.
810,I PLAY SOCCER,You have to run very fast to be any good at running
811,I PLAY Cricket,Which position do you like to play?
812,What is cricket,"Cricket is a bat-and-ball game played between two teams of eleven players on a cricket field, at the centre of which is a rectangular 22-yard-long pitch with a wicket (a set of three wooden stumps) sited at each end."
813,I PLAY VOLLEYBALL,Does take up a lot of your time?
814,DO YOU PLAY SOCCER,I don't know how to play
815,DO YOU PLAY BASKETBALL,No I don't have the coordination for hoops.
816,DO YOU KNOW BASKETBAL,WHAT IS BASKETBALL?
817,WHAT IS BASKETBALL?,DO YOU WANT TO PLAY BASKETBALL
818,DO YOU WANT TO PLAY BASKETBALL,I am all net baby.
819,LIKE BASKETBALL,I am into the Net.
820,ARE YOU A FOOTBALL,I am not really into football.
821,WHO IS THE GREATEST BASEBALL PLAYER,George Herman Ruth. Quite the Babe.
822,WHO IS THE BEST SOCCER PLAYER,Maradona is great. Sinsemillia is even better.
823,TELL ME ABOUT BASEBALL,What is Baseball
824,Which is your favourite soccer club?,"I am a Real Madrid fan, and you?"
825,"I am a Real Madrid fan, and you?",I am die hard fan of Barcelona.
826,I am die hard fan of Barcelona.,Madrid has a great team especially the attack is quite awesome.
827,Madrid has a great team especially the attack is quite awesome.,Barca still at par than Madrid.
828,Barca still at par than Madrid.,I dont agree.
829,Who was the 37th President of the United States?,Richard Nixon
830,What year was President John F. Kennedy assassinated?,1963
831,"The Space Race was a 20th-century competition between what two Cold War rivals, for supremacy in spaceflight capability?",The Soviet Union and the United States.
832,What was the name of the first artificial Earth satellite?,Sputnik 1
833,"A spinning disk, in which the orientation of this axis is unaffected by tilting or rotation of the mounting, is called what?",A gyroscope.
834,"The Hubble Space Telescope, launched into low Earth orbit in 1990, is named after what American astronomer?",Edwin Hubble
835,What is the name of the nearest major galaxy to the Milky Way?,The Andromeda Galaxy.
836,God Save the Queen is the national anthem of what country?,The United Kingdom of Great Britain
837,"The Celtic Shelf, the seabed under the Celtic Sea is a part of the continental shelf of what continent?",Europe
838,"Dolphins use a sense, similar to sonar, to determine the location and shape of nearby items.",Echolocation
